<?xml version="1.0" encoding="UTF-8"?>
<contabilidad xmlns:xsi="http://www.w3.org/2001/XMLSchema-instance" xsi:noNamespaceSchemaLocation="file:///E:/Lenguajes%20de%20Marcas/Git/XML-Esquemas/ejercicio%201_1/sch-7.xsd">
  <apunte>
    <ingreso/>
    <fecha>24 de febrero de 2011</fecha>
    <cantidad>1800.00</cantidad>
    <moneda>euro</moneda>
    <concepto>Salario</concepto>
  </apunte>
  <apunte>
    <gasto/>
    <fecha>28 de febrero de 2011</fecha>
    <cantidad>74.25</cantidad>
    <moneda>euro</moneda>
    <concepto>Recibo luz</concepto>
  </apunte>
</contabilidad>
